{
  "id": "ci-run",
  "version": 1,
  "scope": "system",
  "title": "Прогон тестов ветки в облаке",
  "goal_template": "{goal}",
  "user_value_template": "Ответ по тестам ветки получен из облака: зелёные/красные, упавшие тесты и хвост лога — без локального прогона.",
  "defaults": {
    "max_attempts": 3,
    "execution_timeout_seconds": 900,
    "recovery_policy": "default"
  },
  "inputs": [
    {
      "name": "repo",
      "description": "целевой репозиторий owner/name (или одна GitHub-ссылка в цели)",
      "derive": "github_repo"
    }
  ],
  "stages": [
    {
      "id": "run",
      "title": "Диспатч, ожидание, результат",
      "steps": [
        {
          "title": "Прогнать тесты ветки в облаке и вернуть результат",
          "step_type": "ci-run",
          "instructions": "Тип шага: ci-run — Ответ по тестам без локального прогона: диспатч в GitHub Actions, дешёвое ожидание, упавшие джобы и хвост лога.\n\nРепозиторий: {repo} (если вместо имени репозитория тут слово repo в фигурных скобках — его не передали в playbook_run: определи из цели и итогов прошлых шагов или спроси пользователя).\n\nЧек-лист (пройди все пункты за этот ран; в ИТОГЕ ШАГА коротко отметь каждый: ✅ сделано / ⏭ не нужно — почему):\n1. Повторный ран этого шага НЕ диспатчи заново: возьми run_id из evidence прошлого рана и сразу перейди к проверке статуса.\n2. Диспатч: ci_run_branch(repo: \"{repo}\", ref: <ветка>[, suite: <набор>]) → {ok:true, run_id, url}. Репозиторий без ручного запуска ответит {ok:false, configured:false} — сообщи это и ПРЕДЛОЖИ плейбук ci-setup (не запускай его молча); если ответ нужен прямо сейчас, набор можно прогнать локально и сказать об этом явно.\n3. Дождись без зависания внутри рана: task_item_wait(until: {ci_run_green: {repo: \"{repo}\", run_id: <id>}}, poll_every_sec: 120, timeout_sec: 3600, reason: \"ждём прогон тестов ветки\") → DURABLE: waiting. Сервер проверяет условие дёшево сам.\n4. Проснулся → ci_run_branch(repo: \"{repo}\", run_id: <id>) в статус-режиме. conclusion success → «зелёный»: ветка, длительность, url.\n5. conclusion failure → «красный»: перечисли failed_jobs и покажи log_tail (хвост лога упавшей джобы, там видно имя упавшего теста); чини новой веткой/коммитом по правилам репо, новый прогон — новым вызовом.\n6. cancelled / skipped / timed_out → это НЕ зелёный: напиши причину явно («run cancelled») и разберись, кто отменил прогон.\n7. В итоге — одна строка вида «Тесты <ветка>: ЗЕЛЁНЫЕ — <url>» или «Тесты <ветка>: КРАСНЫЕ — <url>, упал <тест>».\n\nГотово, когда: Ветка прогнана в облаке: в ответе статус (зелёные/красные) и url рана, а для красного — упавшие джобы и хвост лога; ненастроенный репозиторий помечен явно с предложением ci-setup.\n\nДля этого плейбука:\n- Если ветка ещё не запушена — сначала git push -u origin <ветка>: диспатч без коммитов на сервере прогнать нечего.\n- run_id после диспатча запиши в evidence шага, иначе повторный ран задиспатчит прогон второй раз.\n\nОбщее для плейбука «ci-run»:\n- Весь обмен с GitHub — одним MCP-тулом ci_run_branch: без run_id он диспатчит прогон и возвращает свой run_id, с run_id он читает статус, упавшие джобы и хвост лога. Другие вызовы к Actions API от руки не пиши.\n- Ожидание — только через task_item_wait с условием ci_run_green и финальной строкой DURABLE: waiting. Busy-wait (цикл с sleep внутри рана) запрещён: он держит слот и жжёт токены.\n- Прогон ничего не сливает и не выкатывает — это диспатч и чтение. Если в репозитории есть деплой-джобы, они на этот запуск не реагируют (свой workflow, свои триггеры).\n- Если репозиторий не настроен — предложи плейбук ci-setup и остановись. Молча настраивать чужой репозиторий этим плейбуком нельзя.",
          "execution_kind": "agent",
          "executor_role": "developer",
          "minimum_model_level": "bachelor",
          "context_budget": "small",
          "validation": {
            "cloud_test_result_reported": true
          },
          "execution_timeout_seconds": 600
        }
      ]
    }
  ],
  "hooks": {
    "task_done": [
      {
        "type": "notify",
        "to": "owner",
        "text": "Тесты ветки прогнаны в облаке: {goal}"
      }
    ],
    "task_failed": [
      {
        "type": "notify",
        "to": "owner",
        "text": "План застрял: {goal} — {error}"
      }
    ]
  }
}
